{
  "coverage": {
    "inspectedFiles": [
      ".agents/skills/mlview/SKILL.md",
      ".agents/skills/mlview/references/WORKFLOW_CONTRACT.md",
      "analyzer/tests/fixtures/notebooks/leak_out_of_order.ipynb"
    ],
    "limitations": [
      "No runtime state was imported or executed; the finding remains an inferred risk based on notebook metadata.",
      "The notebook depends on external file features.npz and a pip install step, which were not independently verified in this workspace.",
      "The analysis is scoped to the single notebook entrypoint and does not claim broader project coverage."
    ],
    "status": "scoped",
    "summary": "The selected notebook entrypoint was read as source and metadata only; no project imports or runtime execution were performed. Source order and recorded execution order are separated explicitly."
  },
  "edges": [
    {
      "basis": "observed",
      "evidence": [
        "ev-setup",
        "ev-load"
      ],
      "id": "flow-setup-load",
      "label": "setup precedes data loading",
      "source": "imports",
      "target": "load-data"
    },
    {
      "basis": "observed",
      "evidence": [
        "ev-load",
        "ev-split"
      ],
      "id": "flow-load-prep",
      "label": "data inputs feed the split workflow",
      "source": "load-data",
      "target": "preprocess-split"
    },
    {
      "basis": "observed",
      "evidence": [
        "ev-split",
        "ev-train"
      ],
      "id": "flow-prep-train",
      "label": "prepared tensors feed the training loop",
      "source": "preprocess-split",
      "target": "train-model"
    }
  ],
  "evidence": [
    {
      "cell": 0,
      "endLine": 7,
      "file": "analyzer/tests/fixtures/notebooks/leak_out_of_order.ipynb",
      "id": "ev-setup",
      "line": 1,
      "quote": "import numpy as np\nimport torch\nimport torch.nn as nn\nimport torch.optim as optim\nfrom torch.utils.data import DataLoader, TensorDataset\nfrom sklearn.model_selection import train_test_split\nfrom sklearn.preprocessing import StandardScaler"
    },
    {
      "cell": 1,
      "endLine": 5,
      "file": "analyzer/tests/fixtures/notebooks/leak_out_of_order.ipynb",
      "id": "ev-load",
      "line": 1,
      "quote": "%matplotlib inline\n!pip install --quiet scikit-learn\nraw = np.load(\"features.npz\")\nX = raw[\"features\"]\ny = raw[\"labels\"]"
    },
    {
      "cell": 2,
      "endLine": 4,
      "file": "analyzer/tests/fixtures/notebooks/leak_out_of_order.ipynb",
      "id": "ev-split",
      "line": 1,
      "quote": "scaler = StandardScaler()\nX_scaled = scaler.fit_transform(X)\nX_train, X_test, y_train, y_test = train_test_split(\n    X_scaled, y, test_size=0.2, random_state=0)"
    },
    {
      "cell": 3,
      "endLine": 10,
      "file": "analyzer/tests/fixtures/notebooks/leak_out_of_order.ipynb",
      "id": "ev-train",
      "line": 1,
      "quote": "model = nn.Sequential(nn.Linear(10, 3))\ncriterion = nn.CrossEntropyLoss()\noptimizer = optim.Adam(model.parameters(), lr=0.001)\nds = TensorDataset(torch.tensor(X_train), torch.tensor(y_train))\ntrain_loader = DataLoader(ds, batch_size=32, shuffle=True)\nfor features, labels in train_loader:\n    outputs = model(features)\n    loss = criterion(outputs, labels)\n    loss.backward()\n    optimizer.step()"
    }
  ],
  "findings": [
    {
      "basis": "inferred",
      "counterEvidence": [
        "ev-setup"
      ],
      "evidence": [
        "ev-load",
        "ev-split",
        "ev-train"
      ],
      "id": "exec-order-risk",
      "message": "The notebook source order is cells 1-4 in sequence, but the recorded execution metadata is 1, 3, 2, 4. This is an inferred runtime-sensitive risk: without executing the notebook in a fresh kernel, it is not possible to prove that the stale/late cell ordering produced an invalid state, but the metadata shows the split cell was recorded as executing before the data-loading cell for this workbook. The interpretation depends on runtime state and metadata outside the source text itself.",
      "nodeIds": [
        "load-data",
        "preprocess-split",
        "train-model"
      ],
      "severity": "medium",
      "suggestion": "Treat the notebook as execution-order-sensitive and rerun it in a clean kernel while preserving the intended source order: load data, prepare split, then train.",
      "title": "Recorded cell execution order differs from source order"
    }
  ],
  "nodes": [
    {
      "basis": "observed",
      "detail": "The notebook begins by importing NumPy, PyTorch, and scikit-learn helpers needed for the data workflow.",
      "evidence": [
        "ev-setup"
      ],
      "id": "imports",
      "label": "Import libraries and model utilities",
      "phase": "setup"
    },
    {
      "basis": "observed",
      "detail": "The second cell reads the feature file and binds X and y to the loaded arrays, which matches a standard dataset-loading pattern.",
      "evidence": [
        "ev-load"
      ],
      "id": "load-data",
      "label": "Load feature matrix and labels from disk",
      "phase": "data"
    },
    {
      "basis": "observed",
      "detail": "The third cell scales features and creates train/test partitions with a fixed random seed before model training begins.",
      "evidence": [
        "ev-split"
      ],
      "id": "preprocess-split",
      "label": "Standardize features and split into train/test sets",
      "phase": "prep"
    },
    {
      "basis": "observed",
      "detail": "The final cell instantiates a linear model, builds a DataLoader, and performs a single gradient-descent loop over the prepared training split.",
      "evidence": [
        "ev-train"
      ],
      "id": "train-model",
      "label": "Train a small neural network on the prepared tensors",
      "phase": "train"
    }
  ],
  "phases": [
    {
      "id": "setup",
      "label": "Setup and imports"
    },
    {
      "id": "data",
      "label": "Data loading"
    },
    {
      "id": "prep",
      "label": "Preprocessing and split"
    },
    {
      "id": "train",
      "label": "Training loop"
    }
  ],
  "producer": {
    "host": "copilot",
    "kind": "host-llm",
    "model": "MAI-Code-1.1-Flash"
  },
  "request": {
    "configuration": "Single notebook inspected; runtime execution not imported or run. Execution metadata is interpreted as observed notebook state only.",
    "entrypoints": [
      "analyzer/tests/fixtures/notebooks/leak_out_of_order.ipynb"
    ],
    "question": "Explain the notebook workflow and separate source order from recorded execution order.",
    "scope": "Selected notebook entrypoint"
  },
  "revision": {
    "id": "dev-notebook-rev-1"
  },
  "title": "Notebook workflow with out-of-order execution metadata",
  "verification": {
    "files": {
      ".agents/skills/mlview/SKILL.md": "4f0c4163225ab105e61b28bc8de4b971f0f09c79b2c55a2557b4b54db0ab7887",
      ".agents/skills/mlview/references/WORKFLOW_CONTRACT.md": "45aca10bd45539296d0ae04746080003c45494434461e2ca929ae69d66c654f4",
      "analyzer/tests/fixtures/notebooks/leak_out_of_order.ipynb": "f3fa7e4837d70e93cb95c04f204d7c2f5701c5f53b1b6c4598abca5e22cb30f9"
    },
    "publishedAt": "2026-09-17T22:22:09.768827Z"
  },
  "workflowVersion": "1.0"
}
