{
  "coverage": {
    "inspectedFiles": [
      "analyzer/tests/accuracy/corpus/tabular_group_cv_clean/train.py",
      ".agents/skills/mlview/SKILL.md",
      ".agents/skills/mlview/references/WORKFLOW_CONTRACT.md",
      ".agents/skills/mlview/references/workflow-example.json"
    ],
    "limitations": [
      "The external feature and encoder modules were not opened in this task, so the exact TargetEncoder internals beyond the call pattern are not independently verified.",
      "The analysis was intentionally limited to the selected entrypoint and the installed MLView guidance; no broader workspace or earlier artifact was inspected."
    ],
    "status": "scoped",
    "summary": "The selected entrypoint and the installed MLView skill were inspected. The flow shows an account-level holdout, grouped inner CV with fold-local fitting, then final retraining and one-time final evaluation."
  },
  "edges": [
    {
      "basis": "observed",
      "evidence": [
        "ev-gs",
        "ev-sgkf"
      ],
      "id": "edge-1",
      "label": "training split feeds grouped CV",
      "source": "node-holdout",
      "target": "node-cv-folds"
    },
    {
      "basis": "observed",
      "evidence": [
        "ev-sgkf"
      ],
      "id": "edge-2",
      "label": "each fold creates inner train and valid subsets",
      "source": "node-cv-folds",
      "target": "node-encoder-fit"
    },
    {
      "basis": "observed",
      "evidence": [
        "ev-sgkf"
      ],
      "id": "edge-3",
      "label": "encoded train and validation data become CatBoost Pools",
      "source": "node-encoder-fit",
      "target": "node-booster-fit"
    },
    {
      "basis": "observed",
      "evidence": [
        "ev-sgkf",
        "ev-fit-final"
      ],
      "id": "edge-4",
      "label": "best validation rounds are used for the final fit",
      "source": "node-booster-fit",
      "target": "node-final-model"
    },
    {
      "basis": "observed",
      "evidence": [
        "ev-fit-final",
        "ev-evaluate",
        "ev-main"
      ],
      "id": "edge-5",
      "label": "final model scores the holdout test set once",
      "source": "node-final-model",
      "target": "node-eval"
    }
  ],
  "evidence": [
    {
      "endLine": 50,
      "file": "analyzer/tests/accuracy/corpus/tabular_group_cv_clean/train.py",
      "id": "ev-gs",
      "line": 43,
      "quote": "def holdout_by_group(features, labels, groups):\n    splitter = GroupShuffleSplit(n_splits=1, test_size=0.2, random_state=SEED)\n    train_index, test_index = next(splitter.split(features, labels, groups))\n    train_x = features.iloc[train_index]\n    test_x = features.iloc[test_index]\n    train_y = labels.iloc[train_index]\n    test_y = labels.iloc[test_index]\n    return train_x, test_x, train_y, test_y, groups.iloc[train_index]"
    },
    {
      "endLine": 90,
      "file": "analyzer/tests/accuracy/corpus/tabular_group_cv_clean/train.py",
      "id": "ev-sgkf",
      "line": 64,
      "quote": "def cross_validate_groups(train_x, train_y, train_groups) -> dict:\n    folds = StratifiedGroupKFold(n_splits=N_FOLDS, shuffle=True,\n                                 random_state=SEED)\n    scores = []\n    best_rounds = []\n    for fold_train, fold_valid in folds.split(train_x, train_y, train_groups):\n        inner_train_x = train_x.iloc[fold_train]\n        inner_train_y = train_y.iloc[fold_train]\n        inner_valid_x = train_x.iloc[fold_valid]\n        inner_valid_y = train_y.iloc[fold_valid]\n\n        encoder = build_encoder()\n        encoded_train = encoder.fit_transform(inner_train_x, inner_train_y)\n        encoded_valid = encoder.transform(inner_valid_x)\n\n        train_pool = Pool(encoded_train, inner_train_y)\n        valid_pool = Pool(encoded_valid, inner_valid_y)\n\n        booster = build_booster()\n        booster.fit(train_pool, eval_set=valid_pool,\n                    early_stopping_rounds=200, verbose=False)\n\n        fold_scores = booster.predict_proba(valid_pool)[:, 1]\n        scores.append(roc_auc_score(inner_valid_y, fold_scores))\n        best_rounds.append(int(booster.get_best_iteration() or 1))\n    return {\"auc\": float(np.mean(scores)),\n            \"rounds\": int(np.median(best_rounds))}"
    },
    {
      "endLine": 98,
      "file": "analyzer/tests/accuracy/corpus/tabular_group_cv_clean/train.py",
      "id": "ev-fit-final",
      "line": 93,
      "quote": "def fit_final(train_x, train_y, rounds: int):\n    encoder = build_encoder()\n    encoded_train = encoder.fit_transform(train_x, train_y)\n    booster = build_booster(iterations=max(rounds, 50))\n    booster.fit(Pool(encoded_train, train_y), verbose=False)\n    return encoder, booster"
    },
    {
      "endLine": 107,
      "file": "analyzer/tests/accuracy/corpus/tabular_group_cv_clean/train.py",
      "id": "ev-evaluate",
      "line": 101,
      "quote": "def evaluate(encoder, booster, test_x, test_y) -> dict:\n    encoded_test = encoder.transform(test_x)\n    scores = booster.predict_proba(Pool(encoded_test))[:, 1]\n    return {\n        \"roc_auc\": float(roc_auc_score(test_y, scores)),\n        \"average_precision\": float(average_precision_score(test_y, scores)),\n    }"
    },
    {
      "endLine": 126,
      "file": "analyzer/tests/accuracy/corpus/tabular_group_cv_clean/train.py",
      "id": "ev-main",
      "line": 110,
      "quote": "def main(csv_path: str = \"data/accounts.csv\") -> dict:\n    seed_everything()\n    frame = load(csv_path)\n    features, labels, groups = split_frame(frame)\n    train_x, test_x, train_y, test_y, train_groups = holdout_by_group(\n        features, labels, groups)\n\n    cv = cross_validate_groups(train_x, train_y, train_groups)\n    encoder, booster = fit_final(train_x, train_y, cv[\"rounds\"])\n    report = evaluate(encoder, booster, test_x, test_y)\n    report[\"cv_roc_auc\"] = cv[\"auc\"]\n    report[\"accounts_held_out\"] = int(frame.loc[test_x.index, GROUP].nunique())\n    return report\n\n\nif __name__ == \"__main__\":\n    print(main())"
    }
  ],
  "findings": [],
  "nodes": [
    {
      "basis": "observed",
      "evidence": [
        "ev-gs"
      ],
      "id": "node-holdout",
      "label": "Holdout split by account groups",
      "phase": "split"
    },
    {
      "basis": "observed",
      "evidence": [
        "ev-sgkf"
      ],
      "id": "node-cv-folds",
      "label": "Inner folds preserve account boundaries and class balance",
      "phase": "cv"
    },
    {
      "basis": "observed",
      "evidence": [
        "ev-sgkf"
      ],
      "id": "node-encoder-fit",
      "label": "TargetEncoder is fitted on inner training rows only",
      "phase": "cv"
    },
    {
      "basis": "observed",
      "evidence": [
        "ev-sgkf"
      ],
      "id": "node-booster-fit",
      "label": "CatBoost fits on transformed training Pool with validation Pool for early stopping",
      "phase": "cv"
    },
    {
      "basis": "observed",
      "evidence": [
        "ev-fit-final"
      ],
      "id": "node-final-model",
      "label": "Final encoder and booster retrained on the full training split",
      "phase": "fit"
    },
    {
      "basis": "observed",
      "evidence": [
        "ev-evaluate",
        "ev-main"
      ],
      "id": "node-eval",
      "label": "Held-out test rows are evaluated once with transformed features",
      "phase": "eval"
    }
  ],
  "phases": [
    {
      "id": "split",
      "label": "Group-aware split"
    },
    {
      "id": "cv",
      "label": "Inner grouped cross-validation"
    },
    {
      "id": "fit",
      "label": "Final training fit"
    },
    {
      "id": "eval",
      "label": "Held-out evaluation"
    }
  ],
  "producer": {
    "host": "copilot",
    "kind": "host-llm",
    "model": "MAI-Code-1.1-Flash"
  },
  "request": {
    "configuration": "Default entrypoint values: csv_path='data/accounts.csv'; SEED=17; N_FOLDS=5; holdout uses GroupShuffleSplit(test_size=0.2); inner CV uses StratifiedGroupKFold(n_splits=5, shuffle=True, random_state=17); TargetEncoder pipeline with CatBoostClassifier; no CLI overrides specified.",
    "entrypoints": [
      "analyzer/tests/accuracy/corpus/tabular_group_cv_clean/train.py"
    ],
    "question": "Explain how grouped cross-validation keeps transformations inside the training folds and identify the split, fitted preprocessing, estimator, and evaluation flow.",
    "scope": "Selected entrypoint"
  },
  "revision": {
    "id": "rev-1"
  },
  "title": "Grouped cross-validation keeps preprocessing inside training folds",
  "verification": {
    "files": {
      ".agents/skills/mlview/SKILL.md": "4f0c4163225ab105e61b28bc8de4b971f0f09c79b2c55a2557b4b54db0ab7887",
      ".agents/skills/mlview/references/WORKFLOW_CONTRACT.md": "45aca10bd45539296d0ae04746080003c45494434461e2ca929ae69d66c654f4",
      ".agents/skills/mlview/references/workflow-example.json": "3c487d2f586dc6dcb1abf5eddd5539996c129247a81b565d6f219e9e2d67cecf",
      "analyzer/tests/accuracy/corpus/tabular_group_cv_clean/train.py": "95ee00aad24de83f0eb426b08c0029d2d052aab93fc6bd1ddf738a5aaa4e8566"
    },
    "publishedAt": "2026-09-17T21:03:10.256918Z"
  },
  "workflowVersion": "1.0"
}
